Party,Handle,Tweet,Sentiment,Category
Democrat,repcleaver,RT @LCPA_LLC: @repcleaver visited the #librarylearningcommons today for a candid conversation on gun violence in schools with some of our s…,-0.7579,GunControl
Democrat,RepCohen,RT @RepCohen: Trump’s zeal for administration firings denigrates public servants https://t.co/FVTZZetBmJ An off the wall out of control “ a…,0.0,GunControl
Democrat,BobbyScott,Congratulations to my former Chief of Staff Joni Ivey on receiving the Community Citizenship Action Award from HRCA… https://t.co/3u4xcZGvAk,0.8126,Immigration
Democrat,BobbyScott,"The @washingtonpost found that more than 187,000 students have been exposed to gun violence at school since Columbi… https://t.co/MePjV0BKoo",-0.7783,GunControl
Democrat,BobbyScott,"RT @RepEsty: You see 7,000 pairs of shoes to represent 7,000 children killed due to gun violence since Sandy Hook. I see 7,000 birthdays, h…",-0.9001,GunControl
Democrat,gracenapolitano,Including a citizenship question in the #2020Census only serves to suppress participation &amp; will result in inaccura… https://t.co/bQzX7W0lGp,0.0,Immigration
Democrat,gracenapolitano,Improving services for student Veterans on campus; Enacting critical gun violence prevention measures; and Reducing… https://t.co/B3q0oC36AN,-0.7184,GunControl
Democrat,gracenapolitano,The decision to add a citizenship question to the #2020Census will have long-lasting consequences for cities &amp; stat… https://t.co/7CHn0ykHHq,0.0,Immigration
Democrat,gracenapolitano,RT @HispanicCaucus: Including a citizenship question in the #2020Census only serves to suppress participation &amp; will result in inaccurate d…,0.0,Immigration
Democrat,gracenapolitano,"Americans want action to #EndGunViolence. In fact, 97% of gun owners want to see Congress require background checks… https://t.co/SRRe8aWtP3",-0.2023,GunControl
Democrat,gracenapolitano,"RT @RepTedDeutch: 7,000 pairs of shoes. 7,000 children killed by gun violence since the Sandy Hook massacre in 2012. 

This. Has. To. Stop.…",-0.9001,GunControl
Democrat,gracenapolitano,H.R. 4240 mandates universal background checks for all gun purchases. It is one critical step in the right directio… https://t.co/buzWb6GqOj,-0.5719,GunControl
Democrat,gracenapolitano,"RT @HouseJudDems: The time to take action to strengthen our gun laws is overdue. @RepGoodlatte, @HouseJudDems are ready to work with you to…",0.34,GunControl
Democrat,gracenapolitano,RT @RepTedDeutch: The students of Stoneman Douglas have been clear – America must #neveragain allow the profits of gun manufacturers to com…,0.6124,GunControl
Democrat,gracenapolitano,"CA, CT, IN, WA &amp; OR have all adopted variations of the Gun Violence Restraining Order Act. They are saving lives wi… https://t.co/HYSkxE9OKi",-0.7579,GunControl
Democrat,gracenapolitano,"Horrifying &amp; heart-breaking scene today in Parkland, FL. Gun violence has for the 18th time this year terrorized ou… https://t.co/gyyOD80Wcj",-0.936,GunControl
Democrat,gracenapolitano,RT @RepGutierrez: The House Judiciary Dem staff created this useful fact sheet to counter some of the immigration claims and falsehoods fro…,0.657,Immigration
Democrat,gracenapolitano,Yesterday’s school shooting was the 11th since the beginning of 2018. This is outrageous and should alarm us all. W… https://t.co/VEjrhHe6aI,-0.6597,GunControl
Democrat,gracenapolitano,RT @HispanicCaucus: The family-based immigration system has contributed greatly to America. The majority of naturalized citizens in the U.S…,0.0,Immigration
Democrat,gracenapolitano,"Despite fear-mongering coming from WH &amp; some Rs in Congress, family migration is not a flaw in our immigration syst… https://t.co/zbgNURks71",0.0,Immigration
Democrat,gracenapolitano,"There have been over 1,700 mass shootings since 2012. We must #HonorWithAction and pass strong, commonsense gun saf… https://t.co/wSTM9fGWDU",0.2263,GunControl
Democrat,gracenapolitano,Over 90% of gun owners support expanding background checks. Time for responsible gun owners to #OutShoutTheGunLobby! https://t.co/abQdMu60Er,0.126,GunControl
Democrat,RepAlGreen,Elected officials &amp; I met w/ the Homeland Security Committee to focus on improving Army Corps flood control project… https://t.co/7vHRUCnz5C,0.6369,GunControl
Democrat,RepAlGreen,"Yesterday I attended #TristianHutchins funeral, the 8-year-old victim of a senseless drive-by shooting in Houston.… https://t.co/HRb8pwaRsk",-0.5574,GunControl
Democrat,RepAlGreen,RT @KPRC2: 🔴 #LIVE Rep. Al Green to discuss immigration bill he’s sponsoring to help some deported family members return to the US &gt; https:…,0.4019,Immigration
Democrat,RepAlGreen,Adding a citizenship question to the #2020Census will discourage participation &amp; promote fear in immigrant communit… https://t.co/IUv7pHSrzZ,-0.5267,Immigration
Democrat,RepAlGreen,I am joining these students on #NationalWalkoutDay as we continue to fight gun violence in America. We have been th… https://t.co/IZ6Kqrr8zJ,-0.8442,GunControl
Democrat,RepDavidEPrice,This week I had the opportunity to visit @CCRSolar's new state-of-the-art control center in Research Triangle Park.… https://t.co/KXqabs1slf,0.4215,GunControl
Democrat,RepDavidEPrice,"LAST CALL: If you have not already, visit our People's Choice Awards for the 2018 Arts Competition and vote for you… https://t.co/bN7uaBHvdr",0.4588,Abortion
Democrat,RepDavidEPrice,"For the first time, our office is hosting the People's Choice Awards during the Congressional Art Competition. Foll… https://t.co/vLYFmYchVA",0.4588,Abortion
Democrat,RepDavidEPrice,Spent the afternoon with @RaleighCharter students &amp; heard their concerns about our broken immigration system and ho… https://t.co/K1jH7pMIrZ,-0.4767,Immigration
Democrat,RepDavidEPrice,"RT @SenMarkey: Including a citizenship question on the #2020Census is:
A) a blatant political intimidation tactic to undercount communities…",-0.4215,Immigration
Democrat,RepDavidEPrice,"For years, I have worked to eliminate barriers restricting gun violence research. Today's omnibus is a great first… https://t.co/DoIBG1LYVJ",-0.6124,GunControl
Democrat,RepDavidEPrice,"The @newsobserver is right: it's time we end the prohibition of gun violence research in this country. Today, 70 of… https://t.co/p2Ul93mPgO",-0.7579,GunControl
Democrat,RepMarciaFudge,A citizenship question is another fear tactic brought on by this administration to silence immigrants. @commercegov… https://t.co/guzQwBCY3c,-0.4939,Immigration
Democrat,RepMarciaFudge,"Great to see OH-11 come together and fight for comprehensive gun control laws 
#MarchForOurLives #GunReformNow https://t.co/97XqLLtRZE",0.2732,GunControl
Democrat,RepMarciaFudge,"One month after the horrific shooting at #Parkland, students across the nation and in Ohio are using their voice to… https://t.co/NvgkuaYbr3",-0.6597,GunControl
Democrat,RepMarciaFudge,America’s strength is in its diversity.  The immigration framework put forth by the Trump Administration is a conti… https://t.co/BvvD1pJZrA,0.4939,Immigration
Democrat,RepMarciaFudge,"Republicans control the White House and both chambers of Congress, yet continue to fail the American people by refu… https://t.co/da6qJjo1ey",-0.5423,GunControl
Democrat,RepMarciaFudge,"Over 170,000 gun deaths since 2012. Congress must do more than offer our thoughts and prayers. #HonorWithAction https://t.co/Wxjt9MpJBW",-0.34,GunControl
Democrat,RepBrady,"RT @RepTedDeutch: 7,000 pairs of shoes. 7,000 children killed by gun violence since the Sandy Hook massacre in 2012. 

This. Has. To. Stop.…",-0.9001,GunControl
Democrat,RepBrady,Carmella Hernandez is a Mexican immigrant who is fleeing awful violence. She is living in sanctuary at the Church o… https://t.co/TPzkdMTYoR,-0.7964,Immigration
Democrat,RepBrady,To say that my thoughts and prayers are with the victims of yet another tragic shooting is not enough. It is clear… https://t.co/8yzsHSSe0M,-0.6486,GunControl
Democrat,RepBrady,"How many times are we going to say ""Our hearts and prayers are with the families of those killed"" before we take action on gun reform?",-0.7845,GunControl
Democrat,RepBrady,RT @CeaseFirePA: One of our own got shot down and we still did nothing! - @RepBrady reflecting on inaction after shooting of @GabbyGiffords…,-0.3164,GunControl
Democrat,RepBrady,I applaud #SCOTUS decision to deny guns to domestic abusers. It's time Republicans stop blocking @HouseDemocrats efforts to end gun violence,-0.9231,GunControl
Democrat,RepBrady,Currently protesting on the House floor-our nation deserves a vote on gun control legislation including my bill supporting local gun laws.,-0.5719,GunControl
Democrat,RepBrady,Congratulations @Amtrak for completion of Positive Train Control on Northeast Corridor - a step to make sure the past doesn't repeat itself.,0.8689,GunControl
Democrat,rosadelauro,"Congress needs to act on gun violence prevention measures. The people, our kids, are demanding action. #Team26 #En… https://t.co/VoByFunbSG",-0.8126,GunControl
Democrat,rosadelauro,TONIGHT — Join me at a student town hall on gun violence at West Haven High School. https://t.co/Lbi2auGbux,-0.6486,GunControl
Democrat,rosadelauro,TOMORROW — Join me at a student town hall on gun violence at West Haven High School. https://t.co/5SSCF9HcDz,-0.6486,GunControl
Democrat,rosadelauro,RT @BrianSpyros: @rosadelauro talks with students at #Hamden High School about gun violence to get their thoughts. @WTNH https://t.co/TpTX8…,-0.7579,GunControl
Democrat,rosadelauro,"RT @NBCNews: ""Do you believe that we have a crisis with gun violence in our country?""

Education Sec. DeVos responds when asked about gun v…",-0.9186,GunControl
Democrat,rosadelauro,I am so proud to stand with students as they say #EnoughisEnough and demand that Congress act to prevent gun violen… https://t.co/WlM1JG5joZ,0.1513,GunControl
Democrat,rosadelauro,Students in CT &amp; across the country are standing up and speaking out to end gun violence. Truly inspiring.… https://t.co/pjRof1hgb3,-0.5574,GunControl
Democrat,rosadelauro,"RT @RepTedDeutch: 7,000 pairs of shoes. 7,000 children killed by gun violence since the Sandy Hook massacre in 2012. 

This. Has. To. Stop.…",-0.9001,GunControl
Democrat,rosadelauro,Congress must act NOW on measures to end gun violence. https://t.co/FTvCS27Cut,-0.7579,GunControl
Democrat,rosadelauro,"Americans want action to end #GunViolence. In fact, 97% of gun owners want to see Congress require background check… https://t.co/lnvm2kGBGm",-0.2023,GunControl
Democrat,rosadelauro,200 Democrats &amp; Republicans aren’t afraid of the gun lobby and are willing to pass the #ThompsonKing Background Che… https://t.co/CnMl4cXuRe,-0.3182,GunControl
Democrat,rosadelauro,RT @nowthisnews: #WhatIf young people hold the power to change our country's gun laws? https://t.co/3TmmOqdnP8,-0.34,GunControl
Democrat,RepJohnConyers,It is now @realDonaldTrump’s responsibility to control his impulsive behavior and give diplomacy a chance to work.… https://t.co/51uHy6L1j5,0.25,GunControl
Democrat,RepJohnConyers,"DYK: #TPS was est. through Congress by the Immigration Act of 1990? It covers nearly 325,000 TPS holders: https://t.co/1VTRstebEn  #SAVETPS",0.0,Immigration
Democrat,RepJohnConyers,"RT @lauradfrancis: .@RepGoodlatte: bill proposes a ""true guestworker program"" w/o path to citizenship for current undocumented ag workers",0.4215,Immigration
Democrat,RepJohnConyers,"RT @RepPeteAguilar: .@realDonaldTrump’s attacks on #DREAMers cut to the core of communities, and his extremist immigration ""principles"" wil…",-0.6124,Immigration
Democrat,RepJohnConyers,"RT @RepThompson: If GOP Congress does nothing, its Leadership is complicit. We must establish a Select Committee on Gun Violence. #EndGunVi…",-0.7579,GunControl
Democrat,RepJohnConyers,"@HouseGOP ...adopt legislation designed to actually make Americans safer from gun violence. #Congress must act, and it must do so before...",-0.5719,GunControl
Democrat,RepTedDeutch,"Oliver North tried to intimidate the student-survivors simply because they threaten his gun lobby agenda. 

These s… https://t.co/uqvdfDvNKx",-0.6908,GunControl
Democrat,RepTedDeutch,"RT @RepTedDeutch: .@NRA pres. Oliver North called gun reform activists “civil terrorists”. 

The NRA will do ANYTHING to protect their inte…",0.0516,GunControl
Democrat,RepTedDeutch,"The Jake-Laird Act has bipartisan sponsorship. Democrats and Republicans are both affected by gun violence, and thi… https://t.co/Q2Db5ILikE",-0.7964,GunControl
Democrat,RepTedDeutch,".@NRA pres. Oliver North called gun reform activists “civil terrorists”. 

The NRA will do ANYTHING to protect thei… https://t.co/3S84aTzG8n",0.0516,GunControl
Democrat,RepTedDeutch,Thanks to my colleagues from both sides of the aisle who are working hard to fight for gun safety @SusanWBrooks… https://t.co/Li2QNJtUPf,0.0772,GunControl
Democrat,RepTedDeutch,".@realdonaldtrump says 98% of mass shootings happen in gun free zones.  He’s not even close. Details here:

https://t.co/Ing5BmcsXp",0.2263,GunControl
Democrat,RepTedDeutch,"But I thought MORE guns make us MORE safe?  

Maybe the gun companies who run and fund the @NRA don’t care about sa… https://t.co/TQNY6xjj2z",0.6933,GunControl
Democrat,RepTedDeutch,Thanks to @cdagw for inviting me to talk about how the gun safety debate is changing &amp; the work we can do together… https://t.co/cuWpOEgnyb,0.6808,GunControl
Democrat,RepTedDeutch,"The @NRA raised $2.4 million in March to support candidates who block common-sense gun laws. 

Oh, also, the “All-A… https://t.co/dGNN97RlqU",-0.3818,GunControl
Democrat,RepTedDeutch,"On Feb. 14th, 17 students &amp; teachers were killed in another senseless act of gun violence. 

In March, the @NRA pos… https://t.co/RszUM8bYAK",-0.9001,GunControl
Democrat,RepTedDeutch,Following the latest deadly mass shooting - this time at a Waffle House - we cannot allow the NRA to continue to bl… https://t.co/K32BNUxwgn,-0.1695,GunControl
Democrat,RepTedDeutch,"The @NRA has always mislabeled gun reform efforts as freedom versus tyranny. 

That's nonsense! https://t.co/mvU1HNzPYr",0.1007,GunControl
Democrat,RepTedDeutch,"19 years have passed since the horrific shooting at Columbine. 

Since then, there have been 85 school shootings, 2… https://t.co/mc5U4Al02a",-0.6597,GunControl
Democrat,RepTedDeutch,"“The largest NIH funding commitment in two decades aimed at reducing gun deaths, the second leading cause of fatali… https://t.co/sLzAzoe9Vn",0.0516,GunControl
Democrat,RepTedDeutch,"Kalashnikov USA, the assault weapons producer based in Pompano, may be violating federal laws by importing gun part… https://t.co/GgEPjKjx0H",-0.9118,GunControl
Democrat,RepTedDeutch,It is shameful for anyone to attack students – especially survivors of gun violence – with anti-Semitic slurs and N… https://t.co/zpAEHLSjlx,-0.9196,GunControl
Democrat,AGBecerra,"Around 250,000 undocumented children ages 3-17 are enrolled in CA public schools, and nearly half of all CA childre… https://t.co/FmDAUqCsy6",0.0,Immigration
Democrat,AGBecerra,"Every student, regardless of immigration status, is entitled to feel safe and secure at school. Families should not… https://t.co/legh9MSwcM",0.7506,Immigration
Democrat,AGBecerra,"RT @nytpolitics: Pushback to the citizenship question was immediate: Xavier Becerra, California’s attorney general, is suing the Trump admi…",-0.2732,Immigration
Democrat,AGBecerra,All Californians – regardless of immigration status – have rights. At a time when the #Trump Administration is sowi… https://t.co/9xkxUwKaCq,0.0,Immigration
Democrat,RepJimMcDermott,"RT @allinwithchris: .@RepJimMcDermott: ""The NRA really runs the gun legislation in all legislatures... we can't get gun legislation through…",-0.6517,GunControl
Democrat,RepSheaPorter,"Please read my op-ed on gun violence and prevention. The youth of America want change, and they won’t be ignored. T… https://t.co/ulapFBsmKt",-0.7351,GunControl
Democrat,RepSheaPorter,"After rallying with young people who are calling for gun safety legislation, I spoke on the Floor to call for chang… https://t.co/LOOsS9EUPl",0.1027,GunControl
Democrat,RepSheaPorter,"And yet, they keep happening. Every single week. This cannot continue—we need common sense laws to reduce gun viole… https://t.co/5mKkSrMKXy",-0.34,GunControl
Democrat,RepSheaPorter,"Year after year, they have banned the Centers for Disease Control and Prevention (CDC) and other federal agencies f… https://t.co/8l0vu6B4iC",-0.4588,GunControl
Democrat,RepSheaPorter,"After Sandy Hook, parents and communities across the country advocated for safer gun laws, but five years later, th… https://t.co/mHAuvEn78T",0.0516,GunControl
Democrat,RepSheaPorter,"I am encouraged by yesterday’s decision to block the deportation of 51 of our Indonesian immigrant neighbors, and p… https://t.co/xuH3pEA5iv",-0.1027,Immigration
Democrat,repdinatitus,"RT @SBGC2C: .@repdinatitus on prospects for immigration reform this year: ""They’re not going to do it now before the election. Republicans…",0.296,Immigration
Democrat,repdinatitus,RT @FOX5Vegas: Students walked out of class in the Valley to protest gun violence. @CherneyAmharaTV shares their message and why they walke…,-0.743,GunControl
Democrat,repdinatitus,Republicans pass third bill this week to roll back financial protections instead of taking up gun violence preventi… https://t.co/DeAhpYWSuZ,-0.7579,GunControl
Democrat,DWStweets,"RT @Bradybuzz: The suspect in the recent Waffle House shooting already had his firearm ID card revoked in Illinois, but that information di…",-0.1531,GunControl
Democrat,DWStweets,Cities and states across the nation are passing meaningful gun reform laws to keep our students and our streets saf… https://t.co/S3y9OBlyMQ,-0.0258,GunControl
Democrat,DWStweets,"RT @CBSMiami: .@DWStweets just introduced a new gun safety measure meant to prevent another school shooting tragedy. She said, 'This is the…",-0.5994,GunControl
Democrat,DWStweets,It requires more than just a gun to take an innocent life. It also takes bullets. We need to do all we can to make… https://t.co/8UFeo3ZGWL,-0.0679,GunControl
Democrat,DWStweets,Such an honor to join @TheRAC and @URJorg to speak with students about taking action to prevent gun violence.… https://t.co/PbmYCluwoY,0.4767,GunControl
Democrat,DWStweets,RT @TIME: TIME's new cover: The school shooting generation has had enough https://t.co/4YI173gqTx https://t.co/7yFEXuVjyb,0.0,GunControl
Democrat,DWStweets,RT @60Minutes: Students are calling for change after the Parkland shooting. A group of survivors of the shooting at Stoneman Douglas High S…,0.0,GunControl
Democrat,DWStweets,The NRA (still) wants you to believe that more guns in schools will somehow solve the epidemic of senseless gun vio… https://t.co/CPpJF2btmI,-0.1531,GunControl
Democrat,DWStweets,"Preventing gun violence requires bold action. Trump has talked tough, but he refuses to back it up. I wish I could say I'm surprised.",0.4854,GunControl
Democrat,DWStweets,"RT @HadenMedia: Officials, community &amp; faith leaders, &amp; gun safety advocates discuss w/ @DWStweets ways to keep schools safe and guns off s…",0.7269,GunControl
Democrat,DWStweets,The Florida law that penalizes local communities for taking action to prevent gun violence is absurd. I'm extremely… https://t.co/FOR7ftKocT,-0.7506,GunControl
Democrat,DWStweets,"The bounds of our gun safety debate may finally be changing. We will not stop until our laws change, too.
https://t.co/cTgZZgvxYL",0.3156,GunControl
Democrat,DWStweets,"If local communities like Parkland want to enact sensible gun laws to save lives, Tallahassee should get out of the… https://t.co/kUFITJJ94L",0.5574,GunControl
Democrat,DWStweets,My heart breaks for families in Kentucky and for families all across this nation impacted by senseless gun violence… https://t.co/OXGZ8xZKiZ,-0.34,GunControl
Democrat,DWStweets,"One year ago, our community became the latest to experience a mass shooting we never thought would happen here. Aft… https://t.co/rfed15jeC1",0.0,GunControl
Democrat,DWStweets,"RT @MomsDemand: Many states have laws that go a step further to protect Americans from gun violence. The NRA's pet policy, ""Concealed Carry…",-0.5994,GunControl
Democrat,RepRonKind,"As we wake to the horrific news of the mass shooting in Las Vegas our prayers are with the victims, families, and law enforcement officials",-0.7717,GunControl
Democrat,RepRonKind,Congress needs to take bipartisan action to fix our broken immigration system and make us a stronger and more competitive economy.,0.1263,Immigration
Democrat,repjoecrowley,The Trump administration’s addition of a citizenship question will only discourage participation and result in an i… https://t.co/B3sKkFUqN0,-0.4215,Immigration
Democrat,repjoecrowley,"#NewYork continues to lead the way on combating gun violence, now Congress must do the same. #EndGunViolence… https://t.co/oiHWmn7qF9",-0.7579,GunControl
Democrat,repjoecrowley,Including a citizenship question in the #2020Census will only suppress participation and provide inaccurate data. N… https://t.co/cNFQEPbAuS,0.0,Immigration
Democrat,repjoecrowley,"Tomorrow, I’ll be hosting a #TownhallForOurLives to discuss gun safety reform and efforts to protect our communitie… https://t.co/uGdbjApI4e",0.4588,GunControl
Democrat,repjoecrowley,Looking forward to an important discussion on gun safety reform at my #TownhallForOurLives on Saturday. Details her… https://t.co/1ULTjibW6G,0.296,GunControl
Democrat,RepGeneGreen,It is heartbreaking to hear that Attorney General Jeff Sessions and Director of Immigration and Customs Enforcement… https://t.co/AWr6U82QRh,-0.4588,Immigration
Democrat,RepGeneGreen,The decision to add a citizenship question to the #2020Census will have long-lasting consequences for the future of… https://t.co/jU6w6uNcuM,0.0,Immigration
Democrat,RepGeneGreen,RT @ReadyHarris: FROM @hcfcd | Harris County Flood Control District Begins Drive on $84 million Hurricane Repair Program. More info here ht…,0.0,GunControl
Democrat,RepGeneGreen,The decision to add a citizenship question to the #2020Census will have long-lasting consequences for cities &amp; stat… https://t.co/j393QKlAiV,0.0,Immigration
Democrat,RepGeneGreen,Including a citizenship question in the #2020Census only serves to suppress participation &amp; will result in inaccura… https://t.co/UP3YajRzV0,0.0,Immigration
Democrat,RepGeneGreen,Including a citizenship question to the #2020Census is concerning at a time when the Trump administration has been… https://t.co/P8k3BvzJsw,0.0,Immigration
Democrat,LorettaSanchez,"@HouseDemocrats &amp; I read names &amp; held photos of gun violence victims, to request a vote to #DisarmHate #AskDems https://t.co/Y9nqUbAHvD",-0.8316,GunControl
Democrat,LorettaSanchez,RT @YvetteClarke: FACT: 91 people per day die from gun violence. RT to say it's far past time we #disarmhate. https://t.co/i2FiFALmyd,-0.886,GunControl
Democrat,LorettaSanchez,.@SpeakerRyan: give the American people a vote on commonsense gun violence legislation. We must act! #NoBillNoBreak https://t.co/7mthGOxjkt,-0.7777,GunControl
Democrat,LorettaSanchez,Comprehensive #immigration reform is the moral imperative of our nation! America needs a fair &amp; just immigration system! #SCOTUS #DACA #DAPA,0.5972,Immigration
Democrat,LorettaSanchez,"#SCOTUS deadlock on #DACA &amp; #DAPA is devastating setback for immigrant families, but battle is far from over! #SíSePuede #FightForFamilies",-0.793,Immigration
Democrat,LorettaSanchez,"Unacceptable that Senate Republicans consciously avoided responsible action on #gunviolence, even after deadliest U.S. mass shooting #Enough",-0.4767,GunControl
Democrat,LorettaSanchez,"Let's stand in solidarity with the LGBTQ community against hate, gun violence &amp; terrorism #PrayForOrlando https://t.co/Bj2xILHAOl",-0.9274,GunControl
Democrat,RepGaramendi,I pray that Congress will gain the courage to act in solidarity with every victim of gun violence in America.,0.3612,GunControl
Democrat,RepSchakowsky,Proud to receive the Moms Demand Action Gun Sense Candidate distinction! https://t.co/fSralygFuD,0.126,GunControl
Democrat,RepSchakowsky,"We must protect our children, our families, and our communities from the scourge of gun violence. We can start by l… https://t.co/sLgZCT3haA",-0.5994,GunControl
Democrat,RepSchakowsky,So proud of our Evanston Township High School (ETHS) students taking a stand against gun violence! https://t.co/jQgxy9FM3q,-0.5266,GunControl
Democrat,RepSchakowsky,"We cannot accept this as the new normal.  Gun violence is a scourge and an epidemic, and it requires bold... https://t.co/qbpaKo8vHW",-0.8264,GunControl
Democrat,RepSchakowsky,Support the Illinois Gun Dealer Licensing Act!  We need you to help reduce gun violence in Illinois.  If you can... https://t.co/tXyOhyLpJF,-0.5848,GunControl
Democrat,RepSchakowsky,"Hey everyone--there is a crucial pro-choice action in Schaumburg, which has huge strategic importance, this... https://t.co/1Kzvh3uz7E",0.5859,Abortion
Democrat,RepJoeCourtney,I am truly inspired by the ‘March For Our Lives’ protests against gun violence taking place across the country and… https://t.co/usesK1dvhz,-0.3182,GunControl
Democrat,RepPaulTonko,The Trump Administration has also falsified scientific claims to justify restrictions on birth control access. #ScienceMatters,-0.3818,GunControl
Democrat,RepPaulTonko,Staff at the Centers for Disease Control and Prevention (CDC) were even banned from using the words “evidence-based… https://t.co/rCizwYKuK9,-0.4588,GunControl
