Party,Handle,Tweet,Sentiment,Category
Republican,RepMoolenaar,RT @betsy_klein: Congressional Republicans return to baseball practice months after shooting https://t.co/2lQu9gGBSq,0.0,GunControl
Republican,RepMoolenaar,RT @CMUniversity: The suspect in the shooting incident that happened on CMU's campus is now in custody. Get more details at https://t.co/9L…,-0.296,GunControl
Republican,RepByrne,"RT @SenShelby: Mike Pompeo is an excellent choice for Secretary of State. He is well-qualified, well-educated, and an all-around great Amer…",0.8316,Abortion
Republican,RepGuthrie,The American Health Care Act allows individuals to control their health care instead of bureaucrats in DC. #BetterWay #RepealAndReplace,0.7506,GunControl
Republican,RepGuthrie,My friend Elaine Chao is the perfect choice for Transportation Secretary. Read my full statement: https://t.co/72FxDG6PoN,0.7845,Abortion
Republican,RepBlainePress,"Talking tax reform, health-care, and immigration with @KRCG13 this morning. #MO03 https://t.co/mJSEaePODF",0.0,Immigration
Republican,RepJasonSmith,"Today, Senate had the chance to stop abortions after 20 weeks. They had the chance to protect children who sleep, s… https://t.co/e4gqGz2meJ",0.5267,Abortion
Republican,RepSanfordSC,RT @FreedomWorks: Thanks to @RepSanfordSC for fighting for fiscal sanity. This Key Vote will show America who wants to end out of control s…,0.1027,GunControl
Republican,RepSanfordSC,The New Balance provision was a “de facto earmark” that limits choice to troops and raises cost to taxpayers. https://t.co/mYo5BD6vJH,0.0,Abortion
Republican,RepSanfordSC,RT @thestate: SC’s Mark Sanford meets with students from Florida school shooting https://t.co/d6NMjIBoqP https://t.co/q07CZ91jEr,0.0,GunControl
Republican,RepSanfordSC,"RT @ABCNews4: SC Rep. Mark Sanford talks government shutdown, immigration and offshore drilling . | MORE: https://t.co/V9MQGn140m",0.0,Immigration
Republican,USRepRodney,"RT @SpeakerRyan: Today, the House votes to: 
✔Fully fund @POTUS' wall request
✔Beef up enforcement against illegal immigration
✔Secure our…",-0.5574,Immigration
Republican,Rep_Hunter,If you missed it earlier: I discussed North Korea and illegal immigration on @FoxBusiness with @Varneyco.… https://t.co/UtzuotRiCX,-0.7003,Immigration
Republican,Rep_Hunter,"RT @NatResources: Momentum is building behind H.R. 788, a bill that creates and expands gun ranges on public lands and increases #wildlife…",0.0258,GunControl
Republican,Rep_Hunter,"RT @NatResources: .@Rep_Hunter's bill expands access to shooting ranges on public lands. H.R. 788 is a win for:

✔️ Hunters
✔️ Recreational…",0.6369,GunControl
Republican,Rep_Hunter,"Good Morning, San Diego! I will be on @FoxNews discussing border security and immigration at 6:15am PST.  See you s… https://t.co/O4C6ApX8QK",0.68,Immigration
Republican,Rep_Hunter,I joined @10News this morning talking gun violence and other important issues. https://t.co/wbmRHPQ9sT,-0.6908,GunControl
Republican,Rep_Hunter,Looking forward to joining @cvpayne on @FoxBusiness #MakingMoney at 6:10pm EST/3:10pm PST to discuss immigration re… https://t.co/D3sj4Zl4k2,0.0,Immigration
Republican,Rep_Hunter,"#SchumerShutdown purely political.  @GOP already at table discussing DACA and other immigration issues,… https://t.co/GA8cohIHg1",0.0,Immigration
Republican,Rep_Hunter,"Great time at @KUSINews this morning talking tax reform, immigration and other important issues. https://t.co/WGt7316pxf",0.7096,Immigration
Republican,RepChrisSmith,"Our hearts and prayers go out to all the victims, survivors and family members at today’s deadly mass shooting at M… https://t.co/57zB7JCiPS",-0.3182,GunControl
Republican,SteveScalise,"As I said this morning, Mike Pompeo is a great choice for Secretary of State, and I'm glad the Senate has confirmed… https://t.co/n8OU64CY2h",0.7964,Abortion
Republican,SteveScalise,Glad we finally have a president in @realDonaldTrump who is restoring the rule of law to our immigration system and… https://t.co/vLPBuhFJ4i,0.6369,Immigration
Republican,HouseJudiciary,"@repgoodlatte on getting Immigration reform done with @IngrahamAngle 

SECURE the borders.
CLOSE the loop holes
Kee… https://t.co/XjNhEl4Wve",0.4824,Immigration
Republican,HouseJudiciary,LIVE NOW: on the @IngrahamAngle @RepGoodlatte lays out fair immigration reform which means securing our borders and… https://t.co/kHiAu4OsYC,0.5574,Immigration
Republican,HouseJudiciary,@SecNielsen Tired of abuse in our Immigration system?  #SecuringAmericasFutureAct has the tools to combat asylum fr… https://t.co/7aeWwYYfsc,-0.8591,Immigration
Republican,HouseJudiciary,Thank you @USAGSessions for sending more support to the border. About 84% of asylum claimants never show up for the… https://t.co/5XVjpqZRdx,0.6697,Immigration
Republican,HouseJudiciary,"@RepGoodlatte ""We must ensure that our immigration benefits system is working as efficiently and securely as possib… https://t.co/UMfFwLxQrs",0.8519,Immigration
Republican,HouseJudiciary,"Crime Subcommittee to hold a hearing on violence in America, including the recent shooting at Marjory Stoneman Doug… https://t.co/1EzX5vap0T",-0.8225,GunControl
Republican,HouseJudiciary,"The ""Securing America's Future Act"" bolsters enforcement of existing immigration law, reforms legal immigration pro… https://t.co/RHDXkAZUV3",0.4215,Immigration
Republican,HouseJudiciary,Chairmen @RepGoodlatte and @TGowdySC release key takeaways from the Parkland shooting after a meeting with FBI Depu… https://t.co/joXYgYuRlh,0.0,GunControl
Republican,HouseJudiciary,RT @RepGoodlatte: Coming up after 10AM: Joining @TeamCavuto on Cavuto Live to talk about the latest on immigration reform efforts in the Ho…,0.0,Immigration
Republican,HouseJudiciary,RT @RepGoodlatte: NEW: @TGowdySC &amp; I requested a briefing  from the @FBI on the Florida Shooting https://t.co/XmvecXqhSo,0.0,GunControl
Republican,HouseJudiciary,Happening NOW: House Judiciary Committee immigration hearing on sanctuary cities and the impact on the opioid epide… https://t.co/bRlfARhgSs,0.0,Immigration
Republican,RepDavidValadao,"Fixing our nation’s broken immigration system shouldn’t be a partisan issue. That’s why, I signed a discharge petit… https://t.co/mhbu1gKSyY",-0.4767,Immigration
Republican,RepDavidValadao,"Reforming our broken immigration system is not a partisan issue. This morning, I joined w/ Republicans &amp; Democrats… https://t.co/RJdWK2jsJP",-0.4767,Immigration
Republican,RepDavidValadao,Thanks to the @CAFarmBureau for stopping by my Washington office to discuss immigration and Central Valley agricult… https://t.co/2zaw8k52x1,0.3182,Immigration
Republican,RepDavidValadao,Congress must come together to repair our broken immigration system and provide immigrants with a pathway to earn t… https://t.co/xKAO0qi4Pt,-0.4767,Immigration
Republican,RepDavidValadao,Congress must come together to protect #Dreamers and pass comprehensive immigration reform now. https://t.co/rJINgAxt6F,0.5574,Immigration
Republican,RepDavidValadao,"Congress must act to repair immigration system &amp; ensure children, who were brought through no fault of their own, are allowed to stay.",-0.3182,Immigration
Republican,RepJBridenstine,Just voted to block an Obama reg that would've opened backdoor funding for abortions with taxpayer dollars. #ProLife https://t.co/jmbLBVrfab,-0.4404,Abortion
Republican,RepJBridenstine,RT @reppittenger: Thank you @RepJBridenstine for co-signing my letter outlining shared pro-life priorities for Congress and Pres Trump http…,0.5994,Abortion
Republican,RepJBridenstine,Nothing promotes gun sales like President Obama talking about gun control. #GunsInAmerica,0.5478,GunControl
Republican,RepJBridenstine,"President Obama: ""Enforce the laws already on the books.""  How about the border fence and immigration law? #GunsInAmerica",0.0,Immigration
Republican,RepJBridenstine,Norway and Gun Control https://t.co/2S4EiTe5Co #GunsInAmerica,-0.34,GunControl
Republican,RepJBridenstine,Norway was the site of the world's largest mass killing by a lone gunman. They have very strict gun laws. #GunsInAmerica,-0.8473,GunControl
Republican,RepJBridenstine,"""Case by case evaluation"" means subjective choice of who needs a license. Corruption. #GunsInAmerica",0.0,Abortion
Republican,RepJBridenstine,There is no gun show loophole. A licensed dealer must do a background check wherever he/she sells. #GunsInAmerica,-0.5574,GunControl
Republican,RepJBridenstine,"Mr. President, the gun show loop hole does not exist.  All licensed dealers must conduct background checks. #GunsInAmerica",-0.34,GunControl
Republican,RepJBridenstine,Gun ownership is at an all time high and violent crime has decreased. #GunsInAmerica,-0.8689,GunControl
Republican,RepJBridenstine,Fact: The President’s gun control executive actions would do nothing to stop mass shootings. #GunsInAmerica,-0.1311,GunControl
Republican,RepJBridenstine,Only way to stop executive gun control is to use the power of the purse.  Republicans took that off the table with the Omnibus. #tcot #2A,-0.5574,GunControl
Republican,RepJBridenstine,Obama's executive gun control will infringe on the #2A rights of law-abiding Americans https://t.co/4l66j8hbEj #tcot https://t.co/DA3XPGI9v5,-0.34,GunControl
Republican,RepJBridenstine,"I am a cosponsor of H.R.217 – Title X Abortion Provider Prohibition Act, which would revoke taxpayer funding for #PlannedParenthood .",0.0,Abortion
Republican,RepAndyBarr,"Last night, Senate Democrats made the choice to strip funding from the Children's Health Insurance Program and deny… https://t.co/StlC7uQWnP",0.0,Abortion
Republican,RepRWilliams,"RT @FoxBusiness: .@RepRWilliams on illegal immigration in Texas: ""We've had this problem a long time."" https://t.co/4sb5PS56TJ",-0.7734,Immigration
Republican,RepRWilliams,"The safety of Americans is absolutely paramount, and as a strong supporter of tougher immigration laws, I applaud… https://t.co/EkDSWIhO8F",0.836,Immigration
Republican,RepPaulCook,I am deeply saddened by the news of another mass shooting in #SutherlandSpringsTexas. It is time to end these senseless terrorist acts.,-0.8553,GunControl
Republican,RepPaulCook,My deepest condolences to all those affected by the shooting at North Park Elementary School today https://t.co/Fwdxx5X4FP #SanBernardino,-0.1531,GunControl
Republican,RepPaulCook,"RT @SBPDChief: There is a report of a shooting at Northpark Elementary. Large police response, please stay out of the area. More info to fo…",0.3182,GunControl
Republican,SusanWBrooks,Poison Control Centers are on the front lines of the #opioidepidemic. The data poison centers collect can be used t… https://t.co/8qFrACyFxX,-0.7906,GunControl
Republican,RepChrisStewart,Republicans and Democrats need to work together and reform our immigration policies. #SOTU https://t.co/7PJyfzF11N,0.0,Immigration
Republican,RepChrisStewart,Mr. Schumer why do you care more about illegal immigration than children's health care. CHIP is important for 9 mil… https://t.co/WmDRnrqRVG,0.5141,Immigration
Republican,RepChrisStewart,Why won't the Democrats agree to border security? Why is immigration more important than funding our soldiers. Why… https://t.co/fBQF5Ys9ZX,0.3363,Immigration
Republican,RepChrisStewart,My view=these devices circumvent the Gun Control Act and the National Firearms Act. This type of modification to a gun should be controlled.,-0.5859,GunControl
Republican,RepChrisStewart,Like most Americans – and most gun owners – I wasn’t aware of bump stocks. It is my view that these devices deserve scrutiny.,-0.0498,GunControl
Republican,RepChrisStewart,Any life taken through gun violence is a tragedy. Any time that happens our first thoughts should be for the victims and their families.,-0.9217,GunControl
Republican,RepChrisStewart,"The gun debate deserves real introspection, and thoughtful reaction guided by the facts and respect for the Constitution.",0.5106,GunControl
Republican,RepTedYoho,Enforcing our immigration laws and securing our southern border is paying off. https://t.co/OpxNdNfaLS,0.3182,Immigration
Republican,RepLaMalfa,ICYMI: I spoke with @KRCR7 to share my thoughts on the Administration's decision to add a citizenship status questi… https://t.co/VDDQLLmhjt,0.296,Immigration
Republican,RepLaMalfa,"WATCH: @POTUS &amp; @FLOTUS made a tremendous choice in selecting Preston Sharp from Redding, CA as a special guests fo… https://t.co/P7WxtVWZjt",0.4019,Abortion
Republican,RepLaMalfa,"This week is National School Choice Week, where we celebrate the opportunity for families to choose what learning o… https://t.co/jCeWwmNqzv",0.7579,Abortion
Republican,RepLaMalfa,"RT @HouseJudiciary: This week, Congress is addressing the lack of immigration enforcement and the spread of sanctuary policies that have ha…",-0.3182,Immigration
Republican,RepDougCollins,"Democrats shut down the govt to protect illegals last night. Just to be clear, American troops and the children rel… https://t.co/6LUjhVECMm",0.6369,Immigration
Republican,RepDougCollins,"While Democrats shut down the govt to protect illegals this week, @HouseGOP voted to keep the government open, supp… https://t.co/IDw29bBHsB",0.3818,Immigration
Republican,RepDougCollins,"Children born alive during an abortion attempt are particularly vulnerable, and they should be guaranteed the medic… https://t.co/fLt6hTLzS6",0.1045,Abortion
Republican,RepDougCollins,"The House has a #ProLife bill, HR 4712, the Born-Alive Abortion Survivors Protection Act, on the floor today. Here'… https://t.co/s2W43aAbE7",0.0,Abortion
Republican,RepMullin,Joining @FoxNews shortly to talk Parkland shooting &amp; immigration. Tune in now!,0.0,GunControl
Republican,RepMullin,"RT @NewsOn6: Gun Violence Starts With Desensitized Kids, Mullin Says https://t.co/qyK4HX9cdh",-0.7579,GunControl
Republican,RepDeSantis,Larry Kudlow would be a great choice to be director of the White House National Economic Council.  Larry is a pro-g… https://t.co/jHUjjB5WoU,0.6249,Abortion
Republican,RepHolding,The House passed a bill today aimed at keeping illegal immigrant gang members out of the United States ... https://t.co/dpsZ55RdCC,-0.2023,Immigration
Republican,RepHolding,"In 2015, Kate Steinle was murdered in San Francisco by an illegal immigrant who had been deported multiple times... https://t.co/OEROuhleLU",-0.8402,Immigration
Republican,RepHolding,I spoke out against the president’s unconstitutional actions on immigration today. WATCH here -&gt;  https://t.co/3CIClnsgCH,0.0,Immigration
Republican,RepTomRice,President Trump is ready to bring our immigration system into the 21st century. https://t.co/5EHiPwlknJ,0.3612,Immigration
Republican,RepChrisCollins,"Whether it is immigration reform, labeling, or holding Canada accountable to make sure we have a fair export-import… https://t.co/cWSNHMghAr",0.5574,Immigration
Republican,RepChrisCollins,"I am heartbroken to hear the news about the shooting in Florida, thoughts and prayers are with the students, teache… https://t.co/ML933WnU16",-0.6486,GunControl
Republican,RepChrisCollins,We are preserving choice for our nations veterans. Thank you to all who have served #SOTU,0.3612,Abortion
Republican,RepChrisCollins,It is National School Choice Week (NSCW) to celebrate effective education choice options for children in grades K t… https://t.co/jgxHyqShnC,0.7783,Abortion
Republican,TXRandy14,No one's conscience rights should be violated - whether it's taxpayers being forced to fund abortions or nurses bei… https://t.co/oKX1gwQ6Es,-0.8225,Abortion
Republican,TXRandy14,"Last night Senate Ds had a choice – fund CHIP, provide tax relief, support the military, &amp; keep the government open… https://t.co/cAXM0bKYWD",0.7003,Abortion
Republican,RepAnnWagner,"RT @IvankaTrump: “Sex trafficking has largely moved from the streets to the Internet, where traffickers maintain control of victims across…",-0.3182,GunControl
Republican,RepAnnWagner,RT @SpeakerRyan: Yesterday's shooting was pure evil. There's just no other way to describe it. The whole country stands with the Parkland c…,-0.765,GunControl
Republican,RepKevinCramer,"The House has passed 40+ financial deregulatory bills, and the Financial Choice Act, this Congress. Glad to see… https://t.co/CbZWc7aW3n",0.4588,Abortion
Republican,RepKevinCramer,"RT @WhiteHouse: ""My Administration has identified three major priorities for creating a safe, modern and lawful immigration system: fully s…",0.6249,Immigration
Republican,RepKevinCramer,"How can @CollinsworthPFF not see that the receiver had enough control of the ball to catch it, take two steps, dive… https://t.co/eyczv40vLB",0.0,GunControl
Republican,RepKevinCramer,@WashTimes It is disappointing the Senate did not join the House to restrict abortions after 20 weeks - the point w… https://t.co/o2Uj3bgVvf,-0.7709,Abortion
Republican,RepLukeMesser,No locality should get an illegal immigrant bonus. The Funding Americans First Act would ensure Hoosiers aren't sub… https://t.co/kACVAFZn9S,0.0772,Immigration
Republican,RepLukeMesser,"RT @BrendanKKirby: Exclusive: @RepLukeMesser bill would end ""illegal immigrant bonus"" in population-based federal grants. https://t.co/WRqU…",0.3182,Immigration
Republican,RepLukeMesser,Hoosiers get it: Targeting the Constitutional rights of law-abiding gun owners is not the answer. I applaud @POTUS… https://t.co/9ooGahn1Xd,-0.5967,GunControl
Republican,RepLukeMesser,Hoosiers get it: Targeting the Constitutional rights of law-abiding gun owners is not the answer. I applaud… https://t.co/s5cGZhN4wK,-0.34,GunControl
Republican,RepLukeMesser,"Instead of targeting the Second Amendment rights of law-abiding gun owners, we need to focus on securing our school… https://t.co/Pm0fNfnmTY",-0.0258,GunControl
Republican,RepLukeMesser,My good friend Mike Pompeo will be an excellent Secretary of State. A great choice by @realDonaldTrump! https://t.co/dUxDkLSBbo,0.9348,Abortion
Republican,RepLukeMesser,I echo @realDonaldTrump's concern that it’s long past time to deal with illegal immigration in this country. Clearl… https://t.co/uxbm0ZOvmp,-0.5574,Immigration
Republican,RepLukeMesser,"RT @FoxNews: .@RepLukeMesser on immigration reform: ""I want to make sure we give the president the latitude he needs to get this done.""  #C…",0.3818,Immigration
Republican,RepLukeMesser,"RT @JessicaASmith8: .@RepLukeMesser, @tedcruz and @BetsyDeVosED at School Choice rally. Messer says “when parents have a choice, kids have…",0.0,Abortion
Republican,RodneyDavis,"Women’s Choice Award- “Not Yet Defined” by Brooke Gibbs, Northwestern High School https://t.co/ZgMJrZ6jWJ",0.5423,Abortion
Republican,RodneyDavis,"RT @heraldandreview: .@RodneyDavis talked gun control, school security, Farm Bill and more during an interview with Decatur high school sen…",0.0,GunControl
Republican,RepDaveJoyce,The Center for Disease Control and Prevention has updated their resources for confronting opioids with data &amp; opioi… https://t.co/q80e877DYP,-0.1531,GunControl
Republican,RepDaveJoyce,Thank you @LakeCoNursery for hosting me today to talk about immigration &amp; job growth. The Lake County Nursery Growe… https://t.co/k5WJL4pSx4,0.6249,Immigration
Republican,RepThomasMassie,"Waffle House shooting illustrates the danger posed by gun-free zones
https://t.co/86cHYZgCR3",-0.5267,GunControl
Republican,RepThomasMassie,Give airports control of their own revenues and they’ll be less dependent on the federal government.  Thank you… https://t.co/IoJaLMeBhE,0.3612,GunControl
Republican,RepThomasMassie,"@techreview Given a choice between having a boss as a caretaker, and taking care of themselves, people are choosing… https://t.co/bQq4AYVT1A",0.4939,Abortion
Republican,RepThomasMassie,@Randy_0302 Not now.  He signed it.  It’s binding until it expires at the end of the fiscal year (except the gun co… https://t.co/XCGJojwMzW,-0.34,GunControl
Republican,RepThomasMassie,@ScottKnittle One gun owner told me he was sold out and “the Trump slump is over.”  ...referring to drop in sales o… https://t.co/uYx5nng1oG,-0.5423,GunControl
Republican,RepThomasMassie,"🤦🏻‍♂️ As if #fixNICS gun control in the #omnibus wasn’t enough to lay on conservatives today.  BTW, Obama ATF didn’… https://t.co/FuctEPJyrw",-0.34,GunControl
Republican,RepThomasMassie,"I have less than 60 minutes to offer this amendment to strike gun control from the 2,232 page omnibus funding bill.… https://t.co/8EWiFc8oka",-0.4404,GunControl
Republican,RepMarkMeadows,"My friend Jim Bridenstine is as principled, thoughtful, and dedicated as anyone you'll find. An excellent choice by… https://t.co/7bxltwiIwq",0.91,Abortion
Republican,RepMarkMeadows,I truly believe there is no better choice for Secretary of State than my friend Mike Pompeo--one of the most though… https://t.co/yWVlQBDZg0,0.7783,Abortion
Republican,RepMarkMeadows,President Trump could not have made a better choice for National Security Advisor than @AmbJohnBolton. He is excell… https://t.co/44GuniL3o6,-0.0015,Abortion
Republican,RepMarkMeadows,"RT @FoxNews: .@Jim_Jordan: ""The American people didn't elect Democrats to control the United States Congress. They elected Republicans."" ht…",0.4215,GunControl
Republican,RepMarkMeadows,Mike Pompeo is the right person for Secretary of State. Excellent choice by the President. https://t.co/5xbcQWH49e,0.5719,Abortion
Republican,RepMarkMeadows,Why should Congress continue pouring taxpayer dollars into cities that defy federal immigration law? That shouldn't… https://t.co/NyNEBaWlKd,0.0,Immigration
Republican,RepAndyHarrisMD,Discussing the ways we can prevent gun violence in schools live on @ABC7News https://t.co/qfmjbJWNCL,-0.7506,GunControl
Republican,RepAndyHarrisMD,ICYMI: Last night I led a Special Order in support of pro-life pregnancy centers. California is trying to infringe… https://t.co/vbsbVpaEB0,0.6597,Abortion
Republican,RepAndyHarrisMD,Tonight after votes I will speak on the House floor in support of pro-life pregnancy centers in the @NIFLA v. Becer… https://t.co/XJBJZgWuFp,0.4019,Abortion
Republican,RepAndyHarrisMD,"On March 1, I'm hosting an immigration town hall meeting at the Joppa-Magnolia VFC. All #MD01 residents are welcome… https://t.co/fYixnmHNUb",0.0,Immigration
Republican,RepAndyHarrisMD,RT @MeganWBAL: #BREAKING: Following schools in Harford Co. on modified lockdown after reports of shooting in the area. We're live now. Foll…,0.0,GunControl
Republican,reppittenger,.@realDonaldTrump choice of Mike Pompeo as Secretary of State will provide him a clear assessment of prevailing thr… https://t.co/8xc56hdu1x,0.3818,Abortion
Republican,reppittenger,"The horrific school shooting in Florida last week serves as a reminder that violence, hopelessness, &amp;  lack of resp… https://t.co/qSRn2zGZVY",-0.9423,GunControl
Republican,reppittenger,Senator Schumer &amp; @SenateDems made the choice to put illegal immigrants over the health care of 9 million American… https://t.co/tBD2nZOvDt,-0.1027,Abortion
Republican,reppittenger,RT @GOPLeader: Why are you holding our troops and the government hostage for an unrelated immigration fight? #SchumerShutdown https://t.co/…,-0.3818,Immigration
Republican,reppittenger,RT @CatSzeltner: .@PPact &amp; other abortion providers are getting a tax giveaway -- but @RepPittenger is trying to put a stop to it with his…,-0.4215,Abortion
Republican,MikeKellyPA,"@jeisrael @thinkprogress Just for the record, the phrase of choice is ""pumping sunshine"" with a ""p."" Listen carefully!",0.6114,Abortion
Republican,RepRichHudson,"RT @NRA: Many of us choose to own a gun for hunting, for sport, or for protection. And that’s our right – protected by the plain language o…",0.128,GunControl
Republican,RepRichHudson,Mike Pompeo is an incredible choice to serve as our nation's top diplomat. He has a solid track-record of standing… https://t.co/gGsHnYRrsB,0.34,Abortion
Republican,PatTiberi,RT @fema: We created an #Irma rumor control page to help you verify what’s true and what’s not. Visit it here: https://t.co/nnXuF8Q7E8 http…,0.7579,GunControl
Republican,JimPressOffice,It was great to meet with some of the passionate pro-life Wisconsinites who made the trip to D.C. to participate in… https://t.co/VOQ5V5UXm6,0.8176,Abortion
Republican,JimPressOffice,JUST PASSED: The Born-Alive Abortion Survivors Protection Act. My Statement: https://t.co/6bAqEjE5L5 https://t.co/UKsxJRaVrP,0.0,Abortion
Republican,JimPressOffice,"RT @newstalk1130: Cong @JimPressOffice Sensenbrenner on tax reform, and abortion ban after 20 weeks.  Join @JayWeber3 at 8:30  https://t.co…",-0.34,Abortion
Republican,RepLanceNJ7,President Trump ended President Obama’s executive immigration order last September &amp; requested that Congress pass a… https://t.co/3sEJa6s5jE,0.0,Immigration
Republican,RepLanceNJ7,The Ridge High School chapter of Amnesty International invited me to speak and take questions regarding gun and sch… https://t.co/9sRgUSoVWn,-0.34,GunControl
Republican,RepLanceNJ7,I highly criticize any such remarks made by POTUS — beneath the office &amp; unhelpful to critical immigration negotiat… https://t.co/2POVdTWdnW,-0.6361,Immigration
Republican,RepDLamborn,Several pro-life leaders from our community joined me to discuss how we can protect the sanctity of life in our dis… https://t.co/Bqqgn10QmB,0.3818,Abortion
Republican,RepDLamborn,California has passed a law to force pro-life pregnancy care centers to advertise for abortion clinics. If that sou… https://t.co/dsSHrVkTLU,0.4939,Abortion
